Type,Details
Location,"86 This form of aid distribution is als o re˘ected in Israeli defence minister Yoav Gallant™s stated plan for Gaza: ‚We will is olate areas, remove Hamas operatives from thes e areas and introduce forces that will enable an alternative government to form Œ an alternative that threatens Hamas.™ Israe l™s approac h to such an alternative government is doc umented con cretely in its day-after plans, which envision collaboration with cooperative Palestinian civic organisations ."
Location,"67 88 The Netzarim corridor als o hous ed the temporary ˘oating pier, built by the Israeli military™s ally the US military, as an alternative mean s of supplying aid to Palestinians in north Gaza. However, the fact that the pier (which wa s re moved in July) was ins talled in an Is raeli mili tary zo ne made aid wor ker s reluc tant to c oop erate with delive ries originating there. According to a doc tor wo rking w ith an International Medical Corps mission in Gaza, aid workers began to avoid the area when Israeli helicopters were seen taking o˜ from near the ˘oating US p ier in June, during a hostage rescue miss ion in which hundre ds of Palestinian s were kille d."
Location,68 Thi s sighting of the Israeli military ne arby the US pier raise d concerns that the location of the p ier in the Netzarim corridor meant that it could be used not only for aid administration but als o for military logistics.
Location,"WFP also lost access to its main warehouse in so uthern Gaza, because it was included within an evacuation zone."
Location,"98 (d ) On 11 A pril 2024 , Firas Market in Zeitoun was targeted, killing at least six people and injuring 20. On the same day, s even people were reportedly killed when a market in al- Nus eirat refugee camp was struck. [ID: 4041125044] (e) O n 16 April 2024 , the Israeli milit ary bombed a market in al-Maghazi, killing 15. Accordin g to Amn esty International: ‚Th e munition lan ded in th e middle of a m arket street wh ere children were play in g around a foo sball t able . Amnesty International reviewed four video s and 22 photographs ˚lm ed by residents and journalists, and those taken at the scene by its ˚eld workers. [...] The pattern of damage at the scene, and the electronic components in the recovered fragments, matched that of small precision- guided missiles and glide bombs launched by Israeli drones. No helicopter or planes were reported in the area that day, while drones were heard con sistentl y according to witness es interviewed by A mnest y International."
Location,"101 The blockades were reportedly organis ed on s ocial media 102 and via WhatsA pp, where the locations of incoming aid convoys were shared."
Location,"1 16 On 28 January, Major General Yaron Finke lman, hea d of the Isra eli military™s Southern Command, announced an expanded military zone to prevent protesters from intercepting aid. Police arrested 1 3 protesters 106 and suppressed a crowd of 3 0 0."
Location,"768 1 20 By March , Israeli o˜icials were reportedl y ‚tipping o˜ ™ c ivilian s about the location of incoming aid trucks and allowing protesters to intercept aid at the K arem A bu Salem/Kerem Shalom crossing."
Location,"[ID:  31208 66649] 771 (b) On 9 December 2023 , the Israe li navy ˚red 20mm cannon rounds at adjacent UNRWA guesthous es in Rafah, damaging the west side of the buildings. Ten sta˜ were asleep inside wh en th e att ack occurred. UNRWA st ated that it shared th e coordinates with th e I sraeli authorities, was not aware of any military targets in the area at the time, and received no warning about the attack. Foll owing the attack, the d eputy command er of the Israeli Southern C ommand told UNRWA that the attack was an error. [ID: 31209  63891] (c) On 12 Novemb er 2023 , ‚one of UNRWA™s decon˘icted guesthous es was hit by three shells ˚red by the Israeli navy. Fortunately, no one was injured, as the team had left the residence at the time of the incident, however, a guard was in the building at the time and had to directly evacuate.™ [ID: 3111247368] (d ) On 2 Jun e 2024 , ‚the Israeli navy ˚red a shell at a decon˘icted UNRWA guestho use.™ [ID:  4060244540] (e) On 8 June 2024 , ‚shrapn el came ins ide a decon˘icted UNRWA guesthouse from heavy I sraeli airstrikes nearby.™ [ID: 4060820919] (f) On 8 June 2024 , ‚an Israeli air force quadcopter drone ˚red and hit the rooftop water tanks of a decon˘icted UNRWA guesthous e.™ [ID: 4060846 721] (g) O n 25 June 2024 , ‚the Israeli navy ˚red two shells at a decon˘icted UNRWA guestho use.™ [ID: 4052539598] 1 26 On  17 occasions, the  Israeli  military  targeted  UNRWA  warehous es  and  humanitarian  aid  distribution centres, according to the reports."
Location,"(a) On 16 O ctober 2023 , ‚the [Is ra eli air force] targeted Sabra D istr ibu tion Centre, cau sing severe damage to the installation, and surrounding area.™ [ID: 3101621553] (b) On 18 November 2023 , relief aid warehous es of the UNRWA in al- Shati refuge e camp and Jabalia ref u g ee c amp we re targ eted in two dis tinc t s trikes. [ID: 3111802837] [ID: 3111852260] (c) On 4 Janua ry 2024 , ‚two tank shells targeted the Zawayda NFI Store. This caused a ˚re in the store, trapping two UNRWA guards in side. Israeli tanks surrounde d the location and instructed the trapped guards to evacuate.™ [ID: 4010499234] (d ) On 18 January 2024 , ‚ the I sraeli air force t argeted th e Deir el-Balah distribution c entre ."
Location,"Fortunately, no injuries were reported, however, damages were reported.™  [ID: 4012419041] (e) On 22 Januar y 2024 , ‚Khan Younis West Sto re was c omp l etely bur ned ou t du e to Is raeli shelling. Fortunately, no deaths or injuries were reported.™ [ID: 4012252404] (f) On 13 March 2024 , ‚an Israeli air force drone targeted the inside yard bet ween the Rafah NFI Sto re and the Rafah Ea s t distributio n ce ntre. The re were seve n fatalities (two of them UNRWA sta˜ members) and 23 injured persons as a result of the inc ident (among them UNRWA pers onnel: eight UNRWA sta˜, fourteen [participants in UNRWA™s Job Creation Programme] ... To provide just one example of how an incident such as those above practically impacts the provision of humanitarian assistance in Gaza, we note that, following the Israeli air force™s striking of Rafah east distribution centre on 13 March 2024, the incident halted the receipt of 772 trucks of humanitarian aid coming from Rafah crossing to the distribution centre and halted the dispatch of humani tarian aid to thirty-˚ve d esignated e merge ncy s hel te rs in the area, s erving more than one million IDPs. A id operations were further impeded by the imp act of the incident, including direct impacts on UNRWA personnel working at the installation, who were traum atised by it . In addition, ˘o ur distrib ution was brought to a halt as ben e˚ciaries were te rri˚ed to co me to receive aid assistance foll owing the incid ent. The number of bene˚ ciaries who received assistance following this incident was reduced by 55%. Following the incident, including the following day on 14 March 2024, no families received aid assistance from the installation as a result of the Israeli air force™s direct targeting of it.™ [ID: 403137406 5] (g) On 18 March 2024 , ‚an Israeli air force drone targeted A l-Mqayyad distribution centre, east Jabalia.™ [ID: 40 5078380 5] (h) On 19 March 2024 , the director of the Nuseirat polic e station, Mahmoud Al-Bayoumi, was k illed in an Israe li bomb ing that targeted a car in front of the UNRWA headquarters in Nuseirat, in central Gaza. Three civilians were als o killed in the attack. [ID: 40319 89886] (i) On 7 May 2024 , ‚the Israeli military targeted east Rafah distribution centre by artillery shell, targeting inside the northern courtyard, and another she ll outside the eastern wall. No injuries were reported.™ [ID: 40 50783806] (j) On 8 May 2024 , ‚an Israeli quad copte r opened ˚re towards ea s t Rafah warehouse, impac ting the building wall. No injuries were reported™.[ID: 40 5087530 5] (k) On 17 May 2024 (estimate d date), ‚the Israeli military targeted Jabalia distribution centre with t wo tank shells, resulting in damages, and ˚re inside the building.™  [ID: 40617730 55] (l) On 23 M ay 2024 , ‚an Isra eli air force qua dcopter opened ˚re in Lazord Hall warehou se, fortunately causing no injuries. However, the guards had to ˘ee towards the Emirati Hospital.™ [ID: 4052399705] (m) On 25 M ay  2024 , ‚the Israeli air force ˚red two missiles targeting the guards™ room in al- Nuseirat distribution centre (D C) and a women™s activity centre nearby the D C . No injuries were reported in the DC, while six persons were killed in the women™s acti vity centre. The guards™ room was destroyed, and three o˜ices in the DC sustained damaged due to the air strike.™ [ID: 40 525679 57 ] (n) On 3 June 2024 , ‚an Israeli quadcopter drone opene d ˚re and ˚re d several smoke b ombs inside Rafah logistics bas e. Damages were reported, while fortunately there were no injuries reported.™ [ID: 40 60306 535] (o) On 23 June 2024 , ‚an Is raeli air s trike o n a UNRWA training c o ll ege near Gaz a Ci ty being used to distribute aid, and previously us ed as an UNRWA headquarters, killed eight Palestinians.™ [ID:  4062320468] (p) On 11 Jul y 2024 , ‚two [unexploded tank shells] and [explosive remnants of war] were found inside Nuseirat warehouse, resulting in access b eing restricte d to the area for operations™."
Location,132 Civilians were attac ked when Israe l assumed control over aid exc hanges by building the Netzarim corridor and the two chec k points through it on al-Rashid and Salah al-Din Roads (see Chapter 2: Sp atial C ontrol). The corridor ™s role in sieving aid is consistent with the stated aims of Israeli o˜icials to establish ‚humanitarian pockets™ that would be amenable to Israe li control. The points at which the Israeli- designated ‚safe routes™ met areas of Israeli control became the most lethal places for civilians s eeking aid in Gaza.
Location,"144 Notably, the al-Mawasi ‚humanitarian zone™ has no direct access to aid crossings, making aid supply reliant on Israeli control. With the o˜ensive in R afah starting on 6 May 2024, aid to this zone was restricted."
Location,"6 O ur anal ysi s of the relation b etween the cate gories of Israeli military conduct as well as the natural characteristics  of  the  landscape  indicates  the  following: (1) The elements of spatial control, the bu˜er zone, raid routes, and corridors (s e e Chapter 2: Spatial Contro l) were u tilised in tandem wi th the Israeli military™s evacuation orders to concentrate civilians in p arts of Gaza. The Netzarim corridor became an unp assable border, wi th checkpoints that d enied the retur n of civilians who we re disp laced to the sou th back into the north and restricted the amount of aid coming into the north (s ee Chapters 2, 7: Sp atial C ontrol,  Targeting  of  A id, Figure 8.7 , and Figure 8.8 )."
Location,"786 (3) When we layered the above p atterns, outlined in 1 and 2, with the extent of urban destruction, including the destruction of civilian infrastructure, we could determine that areas from which most Palestinian c ivilian s were displace d in the north deprive d those that remaine d there from ess ential means to maintain life and put them at an ongoing risk or forced their displacement to the s outh (s ee Chapter 3: Displacement, Chapter 5: Destruction of Medical Infrastructure, Figure   8.4 , and Figure   8.28 )."
Location,"(5) When we layered the evacuation orders received by Palestinian civilians with the destruction of agriculture, we observed another corre lation: the a gricultural parts in the east parts of Gaz a received evacuatio n o rd er s and the ˚el d s there we re subsequ ently and tho roughly destroyed. The elements of sp atial control were then constructed over the areas from whic h civilians were displaced, suggesting displacement and the destruction of agriculture were an organis ed result of the plan to construct the e lements of sp atial control (s ee Chapters 2, 3, 4:  Sp atial C ontrol,  Displacement,  Destruction  of Agriculture, Figure 8.15 , Figure 8.16 , Figure 8.17 , and Figure 8.18 )."
Location,"(8) Evacuatio n oc cur red fro m area s w ith higher annual p recipi tatio n (up to 500 mm) l evels in the north, to the more arid s outh nearing 200 mm and from areas with fertile s oil (loess and clay) to the area of coastal sand dunes (s ee Chapters 2, 3, 4 Sp atial C ontrol, Displacement, Destruction of Agriculture and Water Res ources, Figure 8.23 , and Figure 8.24 )."
Location,Evacuati on a rr ow s between 6 May a nd 30 A ug ust 2024. The arr ow s shifted to poin t in the directio n of the al-Mawa si ‚humanitarian zone™ after Isr ael took over t he border wit h Egypt and t he exit of Palest inians from Ga za was no longer available.
Location,"Area cleared for t he elements of spat ial cont rol (grey), including t he r aid routes (red lines) and areas invaded by t he Isr aeli military on 2 7 August 2024 (red surfaces). This layering, in t his and t he following page, suggests t hat t he r aid routes have been repeatedly us ed for ground invasion, and may suggest t hat t hey are meant for long-term pres ence."
Location,"Areas cleared by t he Israeli military for t he const ruct ion of t he elements of spat ial cont rol (grey), including t he Netzarim corridor and t he r aid routes, overlayed over areas t hat received evacuat ion order s (yellow), and t he dest inat ion area of t he al-Mawasi ‚humanitarian zone™ (blue). This map shows t he situat ion on 30 August 2024, demonst r at ing t he way t hat spat ial elements of cont rol created two zones: t he nort h above t he Netzarim corridor, and t he al-Mawasi ‚humanitarian zone™, which occupies s ome of t he area s out h of it. Prior to October 2023, t he nort h, including Ga za City, was the cultur al, pol it ical, and business cent re of Ga za. 1.1 million of its inhabitants received evacuation order s and the area was largely destroyed (s ee Chapter 6: Destruction of Civilian Infrastructure™)."
Location,"The populati on that remained lives in da mag ed homes o r in publi c buildings ac ting as shel ters . Aid is r es tri c ted by the two checkpoin ts along t he Netzarim corridor (see Chapter 7: Targeting of A id). P rior to October 2023, al-Mawasi, in the southwest (l abelled ‚south enclave™), was an underdeveloped area of dunes and small-scale cultivation. Since October 2023, it has been increasingly overcrowded wit h tents and ot her tempor ary st ructures t hat do not provide su˜icient shelter from t he weat her and o˜er no privacy. The two areas have a one-way link between t hem - from t he nort h, s out h towards al-Mawasi - but not in t he opposite direct ion."
Location,"The elements of spat ial cont rol Œ including t he expanded bu˜er zone, t he Net zari m corridor, and t he r aid routes Œ s egregated Palest inians in t he nort h from t hos e in t he s out h. The induced exit of Palest in ian civilians from t he nort h became a way to ˚lter and surveil movement from nort h to s out h. Palest inian civilians must pass t hrough two checkpo ints ac ross t he Netzarim corridor, bot h of which oper ate facial recognit ion technology."
Location,"795 Figure  8 .9 L ayering of military invasion (red and red hatch) wit h evacuat ion arrows in January 2024. The arrows lead Palest inian civilians into a tempor ary checkpo int at t he t hreshold of al-Mawasi ™humanitarian zone™ (blue out line), demonst r at ing t he way the ground inva si o n a nd evacuati o n o rd e rs funnell ed Pales tinian civilians in to checkpoin ts, w here they a re surveill ed using facial recognit ion technologies. Note als o t hat t he military has invaded t he ™humanitarian zone™."
Location,"The status of hospitals on 30 J une 2024 overlayed with t he attacks on aid between 7 October 2023 and 30 J une 2024. This layering demonst r ates a spat ial and tempor al condit ion by which t he target ing of aid and t he dest ruct ion of medical infr ast ructure was most s evere in t he nort h. The e˜ects of t he dest ruct ion of medical infr ast ructure are aggr avated by s evere rest rict ion on t he availability of aid, result ing in a zone wit h a lack of life- sustaining infr ast ructure and aggr avated risk to life."
Location,"Areas that fell under the cont rol of t he mi litar y (red and red hatc h) were those where m ost a gr iculture has been dest royed (black). The ground invasion allowed t he military to s end its ˘eet of D9 bulldozer s to plough and dest roy agricultur al ˚e lds, orc hard s, and i nstallations. The dates of analysis are Novembe r and D ecember 20 2 3. The m osaic that form s the bases of analysis includes satellite imagery from 1, 1 6, 21 and 26 November and 1, 6, 11, 1 6 and 26 December (s ee Chapter 4: Dest ruct ion of Agriculture and Water Res ources)."
Location,"The spat ial elements of control including t he expanded bu˜er zone, t he Netzarim corridor, and t he r aid routes are shown to occupy s ome of t he most fert ile areas where agricultur al product ion was highest before October 2023 (grey)."
Location,"The pattern of dest ruction of agr icultur al areas (up unt il 30 J une 2024), including orchards and ˚elds (black), large l y coin cide s with th e areas cleare d for th e construction of an expan de d bu ˜er zone, th e Netzarim corridor, an d th e raid route s. Th e dest ruct ion was focus ed on intensively cult ivated agricultur al areas on t he most fert ile s o il of Ga za. The rubble from dest royed ag ricultu ral in frastructu re and build ings contaminates the soil and ground water with long-term e˜ects (see Chapters 4, 2: Dest ruct ion of Agriculture and Water Res ources, Spat ial Cont rol)."
Location,"Evacuat ion arrows from t he area cleared for t he sp at ial elements of cont rol made it impossible for Palest inians to access what remained of t hei r agr iculture, and furt her faci litated crop dest ruct ion. Eva cuat ion orders (here showi ng eva cuation arrows for t he period of 6 May to 30 August 2024) furt her cont ributed to t he dest ruct ion of t he agricultur al s ector (up unt il 30 June 2024) because farmers were fo rced to aband on cul tiva ted a rea s (see Cha pte rs 2, 4, 3: Spatial Co n tro l, Destruc ti o n of Agriculture and Water Res ources, Displacement)."
Location,"Prior to October 2023, t he nort h and eastern perimeter of Gaza contained t he m ost act ive agricultur al zones. The coastal area and the al-Mawasi ‚humanitarian zone™ had far less agricultural activity. The destruction of Gaza™s agricultural areas co incides wit h t he elements of spat ial cont rol (grey). Evacuat ion arrows (here from 6 May to 30 August 2024) demonst r ate t he displacement of Palest inian civilians towards t he s out hwest of Ga za. Evacuat ion order s have a˜ected most of t he a griculture- producing zones, forcing t he abandonment of cult ivated land."
Location,806 Figure  8.21 A l ayering of the ex tent of urban destruction with evacuation arrows. In blue are areas destroyed before 26 November 2023. The evacuation arrows pertain to evacuat ion order s from 26 November 2023 to 7 January 2024. This demonst r ates t hat civi lians were ordered to eva cuate i nto areas t hat ha d been recent ly dest royed and t hat were not suitable to a ccommodate displaced per sons and lacked functioning infrastructure. .
Location,The elements of spat ial cont rol co incide wit h t he areas of t he most fert ile so il (loess and clay in shades of brown).
Location,"The Netzarim corridor is on t he clay ˚elds nort h of Wadi Gaza, while t he clay ˚elds of B eit H anoun have als o been taken over by t he bu˜er zone and r aid routes in t his area."
Location,"Evacuation arrows derived from military evacuation order s between 6 M ay and 30 August 2024. Displacement occur s from areas wit h t he m ost fert ile s o il (loess and clay) in the east towards t he sand dunes in t he west (see Chapter s 2, 4: Spat ial Cont rol, Dest ruct ion of Agriculture and Water Res ources)."
Location,"Evacuat ion arrows from 7 October 2023 to 6 May 2024 over annual precipitat ion levels. Displacement occurred from areas wit h higher precipitat ion to the more arid s out h (s ee Chapter s 2, 4: Spat ial Cont rol and Dest ruct ion of Agriculture and Water Res ources)."
Location,"Area s o rdered to evacuate (yell ow) bet wee n 7 Oc tobe r 2023 a nd 7 Janua ry 2024 coincide w i th substantial destruction of the street network (red), wh ic h made it m ore di˜icult to eva cuate. The destruction of road s i n the north, Khan Younis, and Rafah, even before it was invaded, created an obst ruct ion to vehicular movement. Ro ads were bombed and rubble from b omb ed buildin gs w as often p iled on the roads. Th ese obstructions interfere d with th e movement of ci vilians try in g to follow evacuation or ders along approved routes. It also made it har der for c ivilian s to use their vehicles for evacuation. Pedestrian movement was a precarious means of movement under ˚re."
Location,The over all dest ruct ion of agr iculture and urban fabric between 7 October 2023 and 30 August 2024 wit hin t he border s of al-Mawasi ‚humanitarian zone™ (in red and wit h its 6 May 2024 boundary). A s t his map shows agricultur al areas are naturally those in between a nd at the mar gins of buil t fabri c. By overlaying the d es truc ti o n of buil dings (blu e) wi th the d es truc ti o n of agricultur al areas (black) we can s ee t he totality of ground level dest ruct ion brought about in Ga za. On ly t he more spar s ely inhabited and less agricultur ally us ed co astal dunes of al-Mawasi exhibit slight ly lighter levels of dest ruct ion (white). Destruct ion within th e ™hum anitarian zon e™ is a lmo st complete ma inly in its eastern parts (the c entre of Khan Younis). Th e we stern par t of the ™humanita rian zone™ wa s not a highly developed a r ea in terms of agricultur e and urba n fa bric befo r e Oc tober 2023. Un til 2005 it was is olated by t he pres ence of t he largest bloc of Jewish s ett lements Œ t he Katif bloc. (s ee F igure 1.1) It has small- scale agriculture (see Chapter 1: Introduction) and few public s ervices.
Location,"812 Figure  8 .27 All areas ordered to evacuate since October 2023 (in yellow), and eva cuat ion arrows between 6 May and 30 August 2024, showing t he way in which Palest inian civil ians were channelled into t he al-M awasi ‚humanitarian zone™ (in red and wit h its 6 May 2024 boundary)."
Location,"813 F igure  8 .28 The level of dest ruct ion superimpos ed over t he evacuat ion order s and evacuat ion arrows leading to t he al-Mawasi ™humanitarian zone™. Areas from where Palest in ian civilians were ordered to evacuate su˜ered widespread dest ruct ion, but so were destination areas Œ areas civilians were evacuated to. Destruction in these destination areas occurred both before civilians were displaced into t hem and after t hey took refuge t here."
Location,The area of ove rall urba n a nd agri cul tural d es tru c ti o n between 7 Oc to ber 2023 and 30 A u g us t 2024 almos t completely overlaps wit h t he areas ordered to evacuate (in yellow). In red is t he al-Mawasi ‚humanitarian zone™ with its 6 May 2024 boundary.
Location,"An overlay of Isr ael™s elements of spat ial cont rol (August 2024) in grey and t he Jewish s ett lements in Ga za before t heir evacuat ion in 2005 (shades of blue), shows s ome correlat ions. The bu˜er zone in t he nort h corresponds to t he locat ion of the northernmost settlement bloc. The N etzarim corridor overlaps with the location of the N etzarim settlement and the security corridor t hat led to it. The area of t he al-Mawasi ‚humanitarian zone™ (here wit h its 6 May 2024 border s) l argely overlaps wit h t he Kat if s ett lement bloc. The reason for t he latter correlat ion is t hat the area of t he evacuated Kat if bloc was by October 2023 on ly relat ively spar s ely inhabited by Palest inians. Raid route number s 9, 10, 11 have been s ecurity ro ads leading to t he Kat if bloc."
Location,"816 9.  Conclusion 817 1 Thi s report investigates the con sequences of Israel™s establishment of a system of spatial control, the Israeli-designated ‚hum anitarian zones™ and other destination areas (where people are ordered to evacuate to)."
Location,"82 1 (j) On 15 Octob er 2023 , Israel K atz posted on X/ Twitter: ‚The decision to open the water to the s outh of the Gaza S trip, which was agreed bet ween Prime Minister Netanyahu and President Biden, will result in pushing the civilian population to the south of the Gaza Strip and will make it possible to tighten the general siege on Gaza in the areas of electr icity, water, and fue l, and will make it easier for the IDF to operate and annihilate the Nazi Hamas infrastructure.™ 12 (k) On 17 October 2023, Israeli Minister of National Security Itamar Ben-Gvir posted on X/ Twitter that ‚as long as Hamas does not releas e the hostages in its hands Œ the only thing that should enter Gaza is hundreds of tons of Air Force explosives, not a gram of humanitarian aid.™ 13 (l) On 18 Octob er 2023 , Israeli Prime Mini ster Benjamin Ne tanyahu , in an address from Israel™s militar y hea d quarte rs in Tel Av iv to Is raeli ci tize ns, stated: ‚we will not all ow humanitar ian assistance in the form of food and medicines from our territory to the Gaza Strip™."
