Type,Details
Location,"169 H˜ FINDINGS 1˜ Quantitative Findings 1.1 The territory including destination areas and the ‚humanitarian zone™ shrank over time: (a) On 13 O ctober 2023, this area included all of Gaza south of Wadi Gaza and covered 228 .2 s q km (62. 5%) of the total territory of Gaza (b) On 7 January 2024, it included Rafah, Deir al-Balah, and the al-Mawasi ‚humanitarian zone™, covering 80.7 s q km (22.1%) of Gaza (c) On 6 May 2024, it shrank to include onl y the newl y estab li she d ‚expande d humanitarian zone™, covering 60.9 s q km (16.6%) of Gaza (d ) On 16 August 2024, the ‚humanitarian zone™ contracted. The area covers 37.9 s q km (10.4%) of  Gaza (e) On 30 August 2024, three blocks have been reintegrated to the ‚expanded humanitarian zone™, exp anding its extent to covering 47.4 s q km (13%) of Gaza (f) The boundaries of the ‚humanitarian zone™ established from 18 October 2023 changed nine times by 30 August 2024."
Location,"1.2 Between 7 October 2023 and 31 August 2024, 84% of Gaza™s total area was subject to evacuation orders (see Figure 3.40 ): (a) The 13 October evacuation order covered 37% of the total area of Gaza (b) After the grid-bas ed evacuation orders were introduced on 1 December, most areas in Gaza were ordered to evacuate at le ast on c e . Between 1 Dec ember 2023 an d 31 August 2024, 72% of Gaza™s total area was subject to evacuation orders (s ee Figure   3.41 ) (c) By 6 May, o nly 6 .9% (25.3 sq km) of area s in Gaza, exclu ding the area of the ‚humani tarian zone™,  had not yet received an evacuation order (d ) A total of 66 evacuation orders were issued bet ween 7 October 2023 and 31 August 2024."
Location,"Total area of Ga za ordered to evacuate since October 2023, making up 84%of t he st rip. Some areas were ordered to evacuate more t han once."
Location,"Total area subject to all evacuat ion order s given between 1 December 2023, when t he grid system was int roduced, and 31 August 2024. 72% of Ga za™s total area was subject to evacuat ion order s during t his t ime and via t his system."
Location,173 2˜ Pat tern Fin dings 2.1 The Israeli military has continuously attacked all areas of Gaza such that no place may reasonably be considered safe.
Location,63 We analys ed the location and timing of all incidents of Israeli attacks in our cartographic databas e in relation to the status of the areas they occurred in.
Location,"6 4 Our data show s that the Israeli military at tacked all area s in Gaza, including when they belonged to the following categories: (a) Destination areas Œ areas to which civilians were ordered to evacuate, including the ‚humanitarian  zone™ (b) ‚Safe routes™ Œ routes designated by the Isra e li military for civilians to ‚safe ly™ evacuate through (c) Unde˚ned areas Œ are as which have neither be en de signated as evacuation are as nor destination  areas (d ) Evacuation areas Œ areas from which civilians were ordered to evacuate 65 The following map (s e e Figure   3.43 ) demonstrates that attacks by the Israeli military camp aign have been pervasive regardless of the designation of an area as a site of shelter, evacuation, or unde˚ned."
Location,"Att acks on south Gaza between 2 December (˚rst order to evacuate Khan Yo unis and to head to the Rafah destination area) and 1 0 December 2023. T his map show s that the Israeli military r epeated ly attacked a destination area, an evacuation area, and an unde˚ned area during this period."
Location,"29 67 A nother cas e is an attack on civilians as they were following Israeli evacuation orders: on 2 9 January 2024 in Gaza Cit y, a six-year- old Palestinian child, Hind Rajab, and six of her family members, as well as t wo Palestine Red Crescent Societ y (PRCS) paramedics, were attac ked and killed by the Israe li military while evacuating from an area subject to an evacuation order."
Location,"68 We investigated the killing of Hind Rajab, and from our sp atial and audio analysis concluded that the Israeli mili tar y direc tly s hot at the c ar Hind and her family we re in at close range, w he re they would have been able to identify civilians and children were pres ent and injured in the vehicle. Furthermore, we es tablished that the direc tio n fro m w hich the ambulance that tried to reach the m was shot at is consistent with the location of the Israeli military on that day."
Location,"177 (B) Attacks on destination areas 6 9 Our res earch records 1,028 airstrikes in Gaza bet ween 7 and 28 October. Of thes e, 426 were in areas s outh of Wadi Gaza, even though the Israeli military had ordered the southward evacuation of all Gazans north of Wadi G aza (s ee Figure   3.45 )."
Location,"Figure   3.45 demonstrates that the Israeli strikes were widespread and continuous north and s outh of Wadi Gaza, including after the 13 October evacuation order instructing civilians to move s outh of Wadi Gaza. This data demonstrates that the Israeli military targeted the area s outh of Wadi Gaza despite designating it as a destination area."
Location,"31 ˛ Incide nt IDs: 31204-83772; 31204-06603; 31204-67873 180 71 We ge olocate d eleven attacks in Rafah between 2 De cemb er 2023 and 6 May 2024, while it was designated as a destination area. Additionally, our research records six attac ks in D eir al-Balah between 8 January and 6 May 2024, while it was designated as a destination area."
Location,"Map of all attacks within municipalit ies designated as dest inat ion areas between 2 December 2023 and 6 May in Rafah, and between 8 January and 6 May in Deir al-Balah. All attacks shown occurred while t hes e areas were designated as destination areas."
Location,"181 72 After establishing the ‚exp anded humanitarian zone™ on 6 May 2024 [Map ID: M40 506 68610], our analysis reveals the Israeli military attacked the ‚humanitarian zone™ at least eleven times bet ween 6 May and 30 August."
Location,Attacks inside t he ‚expanded humanitarian zone™ between 6 May and 30 August 2024.
Location,182 73 A n airstrike was caught on video causing a huge explosion inside the al-Mawasi ‚humanitarian zone™ on 24 May 2024 (see F i g ure 3 .
Location,Video st ills of an attack on t he al-Mawasi ‚humanitarian zone™ on 24 May 2024. The munit ion is circled in red.
Location,"74 On 10 September 2024, another airstrike was recorded in the al-Mawasi ‚humanitarian zone™. (s ee Figure   3.49 ). [Incident ID: 409109166 7 ] Figure 3.50."
Location,Attack on t he al-Mawasi ‚humanitarian zone™ on 10 September 2024.
Location,"34 A nother v id eo, take n w he n the te mpo rar y cease˚re began on 24 Nove mbe r 2023 , s hows the re mains of civ ilians at the same location along the ‚safe route™ designated on al-Rashid Road."
Location,"185 (D) Attacks on unde˛ned areas, including civilian shelters 79 The Israeli military has continuously attacked areas from which it has not told civilians to evacuate."
Location,"80 Th ese att acks have frequently t argeted sh elters, in cludin g al-Nazla school in Jabalia, wh ere ˚ve women and ˚ ve children were reportedly killed on 25 May 2024. They were sheltering in an area outside Israel™s designated evacuation zone (s ee Figure   3. 52 )."
Location,Al- Nazla schoo l was struc k on 25 May whi le in an ‚unde˚ned area™ and prov iding she lte r to many disp laced civ i lians w ho foll owed instruc ti ons to evacuate the nei ghbouring a r ea of Ja bali a. Five women a nd ˚ve children were repo rtedly kill ed in t his attack.
Location,"186 2.2 Destination areas have decreased in size, even as the displaced population has increased Figure 3.53."
Location,Map of area evacuated from nort h to s out h on 13 October 2023.
Location,"81 The area of Gaza into which civilians were ordered to move by the Israeli military has continuously contracted. Initially, the whole territory s outh of Wadi Gaza was designated as a destination area. This area is 228.19 5 s q km in size and constitutes 63% of the area of Gaza."
Location,"187 82 By 6 Dec ember, th e are a civilians were ordered to evac uate to had been reduc ed to 80.8 sq km, comprising 22% of Gaza. T his includes the Rafah municipality, the al-Mawas i ‚humanitarian zone™, and Deir al-Balah."
Location,"I n b lue, all areas, blocks, an d municipalitie s that make up th e de stination areas that th e Israeli military ordere d civilians to go to between 6 December 2023 and May 2024, amount ing to 2 2% of Ga za™s total area."
Location,The ‚expanded humanitarian zone™ boundaries published on 6 May 2024.
Location,"8 3 Following the evacuation order of Rafah on 6 May 2024 [Map ID: M40 506 68610], just prior to the I sraeli groun d invas ion of the city, civilians wh o fo un d sh elter in this area were ordered to relocate northwest  towards  the  newly  de˚ned ‚exp anded  humanitarian  zone™.  A ltogether,  the  area  available  for sheltering was reduced to 60.7 s q km, or less than 17% of Gaza."
Location,"189 84 Between 22 July and 31 Augu s t, the ‚expanded humanitar ian zone™, the only available area for displa ced civilians since 6 May, was subject to further reductions, which cumulativel y reduce d the area from 17% to 13% of the total area of Gaza."
Location,Sequence of maps illustrating the contraction and expansion of the 6 May ‚humanitarian zone™ between 2 2 July and 30 August 2024.
Location,"190 2.3 The Israeli military™s use of evacuation orders has put civilians at risk 85 Isra el™s p ublication and dissemin ation of maps and information related to destination areas, safe routes, and evacuation orders were confusing, inconsistent, and insu˜icient in s everal ways."
Location,"(A) Issuing inconsistent and incomplete information about the ‚humanitarian zone™ 86 Our analysis sug ges ts that boundaries issued fo r the s am e ‚humanitarian zone™ have been inco nsis tent across multiple publications , and have been expanded and contracted witho ut clear communication."
Location,"36 (s ee Figure   3. 5 7 and Figure   3. 5 8 and  A ppendix) 36 ˛ ‚Inhumane Zones, Fore nsic Architec ture™<https: //c onte nt.fore nsic-architecture.org/w p-c onte nt/up l oads/2024/05/Inhumane-Zones- Re - p ort-Forensic-Architec ture_WEBSITE.p df> ac cessed 26 September 2024."
Location,"Four di˜erent boundaries published for the ‚humanitarian zone™ of al-Mawa si between October and December 2023, before t he ‚expansion™ of t he zone in May 2024."
Location,Our analys is sugge sts that th e size an d b o undarie s of th e ‚hum anitarian zone™ in al-Mawasi have varied substantia l ly.
Location,Th e b oun dary pub lish e d on 21 Octob er 2 023 marks th e b order of the zon e in th e context of an evac uation order instructin g civilians to head t here. The boundary published on 6 December marked a signi˚cant ly larger boundary for t he same zone (s ee Appendix for chronology of t he al-Mawasi ‚humanitarian zone™ boundary).
Location,"1 93 87 When the Israeli military announced the ‚exp ansion™ of the al-Mawasi ‚humanitarian zone™ (on 28 A pril in English and 6 May in A rabic), the newly published boundaries, while extending the ‚humanitarian zone™ northwards, als o excluded an area of approximately 5.87 s q km at the s outhern end of the zone, which had been part of the previo us boundary. T he 28 April announcement did not acknowledge or make any explicit reference to this exclusion, and our res earch has not identi˚ed any subs equent publication which acknowledged it."
Location,"88 Civilians within the excluded zone, who did not realis e they were no longer within the ‚humanitarian zone™, stayed in place and were killed in subs equent Israeli airstrikes."
Location,Our anal ysis shows t hat t he 28 April announcement regarding t he expansion of t he al-Mawasi ‚humanitarian zone™ excluded 5.87 s q km from t he previously recognis ed area.
Location,"195 89 Rather than clearly marking the newly excluded zone, on 6 May the Israeli military releas ed maps that pres ented a suppos ed ‚previous™ boundary for the ‚humanitarian zone™ that excluded this same zone, sugge sting continuity between the se published zone s (see Figure  3.60 ). H owever, we were unab le to  identify any  maps published prior  that  included b oundaries for  the ‚humanitarian  zone™  matching this  ‚previous™  boundary."
Location,In blue : mult iple boundaries p ublished for t he al-Mawasi ‚humanitarian zone™. In dark or ange : a boundary of what t he Isr aeli military referred to as t he ‚previous™ boundary of al-Mawasi before it was ‚expanded™. This boundary does not match any of the boundaries published before.
Location,"196 90 A 6 May post on Facebook from the account of an Israe li military spokesperson desc ribes an expansion of the al-Mawasi ‚humanitarian zone™ as follows: ‚the safe zone was expanded from Deir al-Balah in the north, to blocks 2360, 2371, 2373 in the s outh.™ That text description was illustrated by a drawing in which the ‚humanitarian zone™ appeared to include p arts of thos e three blocks, but not all of them."
Location,"92 That video al so sh ows th e boun daries of th e zone expan ding in a way that makes th e actual extent of the zone harder to interpret, suggesting that additional areas of s outhern Gaza are included in the ‚humanitarian  zone™."
Location,"94 Our anal ysi s of satellite image s indicates an incre ased density of tent s in the excluded are a after the new boundary was announced, apparently con˚rming that displaced civilians did not understand this area to be outside the ‚humanitarian zone™ which they had previously been directed into (s ee Figure   3.61 )."
Location,Satellite images fr om 30 April and 15 May 2024 show an increase in tents in an ar ea that was included in the previous border s of the al-Mawasi ‚humanitarian zone™ but was then excluded without explanation from the supposedly ‚expanded™ zone in a map published in Ar abic by t he Isr aeli military on 6 May.
Location,"198 95 This ‚excluded ™ area was hit by an airstrike on 26 May 2024, reportedly killing 45 Palestinians [Incident ID: 40 5268 1379]. News reports suggest that the munition deployed in the strike was a guided GBU- 39 missile."
Location,38 Reports from international aid organisations and media outlets referred to this strike as an attack on a ‚safe zone™.
Location,"39 96 According to our analysis, there were at least t wo more attacks in the same ‚excluded™ area bet ween 6 May and 21 July (s ee ˚gure Figure   3.62 ) [Incident ID: 40 52820860, 406218 146 5]."
Location,39 ˛ ‚Photos: Israel Hits Rafah Camp Ki lling 45 Pal es tin ians in New ﬁMass acre ﬂ™ ( Al Jaz eer a ) <https: //www.aljazee ra.c om/gall e ry/2024/5/27/ photos-israel-bombs-yet-another-gaz a-camp-it-had-declared-a-s afe-zone> ac cessed 26 September 2024 ; ‚Rafah Airs trike Shows ﬁc omp lete Disregard for the Lives of Civilians in Gaz aﬂ | Do c tors Withou t Borde rs - USA™ <https: //www.doctorswithou tborde rs.org/ lates t/rafah-airs trike-c omp l ete-disregard-lives-civilians-gaz a> ac cessed 26 Se pte mbe r 2024.
Location,Attacks on the area excluded from the ‚expanded humanitarian zone™ and inside the ‚expanded humanitarian zone™ on 6 May 2024. Analysis t imefr ame : 6 MayŒ10 September.
Location,"200 (B) Issuing unclear and inconsistent evacuation orders 97 Our analysis reveals numerous inconsistencies by the Israe li military in labelling, marking, and naming evacuation  areas: (a) In the neighbourhood-bas ed map announced on 2 December 2023, our analysis identi˚ed at le ast three errors in the alignment between the names and location s of neighbourhoods on the provided map. Consequently, residents in these neighbourhoods faced signi˚ cant uncertainty as to when their neighbourhood was mentioned, as it was unclear whether civilians residing there should evacuate, or if the map incorrectly referred to a di˜erent location of the same name."
Location,"40 (b) In at leas t seve ntee n ins tances of evacuatio n o rd er s, the s ha d ed areas on the map pos ted by th e I sraeli milit ary onlin e, in dicatin g th e blocks instructed to evacuate, did n ot align with the block numbers listed in the order (s ee A ppendix for non- grid-bas ed evacuation orders)."
Location,"(c) In nin e di˜erent I sraeli milit ary evac uation orders, the shaded areas de signatin g are as subject to evacuation orders did not correspond with the blocks in the evacuation grid. Instead, the borders of those areas crossed over the borders of the blocks , resulting in some blocks being partially included and partially excluded. T his has produced further uncertainty among civilians in those areas abou t whethe r they are being instru c ted to evacuate. One pe r so n res po nded to a similar map published by the Israeli military on Facebook on 2 December 2023 in a comment asking for clari˚cation regarding the areas designated for evacuation: ‚Is Block 53 in Ma™an instructe d to evacuate? Please respond.™ No response to their question was ever posted."
Location,"(d ) In s ome evacuation orders, named locations on the map have been mislabeled. For example, in one order on 2 December 2023, residents were instructed to go to Daraj and Tu˜ah Œ both areas that are located within the areas highlighted for evacuation, while the bottom arrow in the map points to Shuja™iyya, which is not labelled."
Location,"41 (e) Evacuation orders referring to the same area may come from multiple s ources and images, along with inconsistencies and contradictions . For example, in the announcement published on Facebook on 2 December 2023 ordering area s in K han Younis to evacuate, three overlapping but signi˚cantl y di˜erent re gion s are highlighte d in separate images and publi shed side by  side."
Location,"41 ˛ Evacuation orde rs M-31201-63867 and M -3120 2-8 2269 42 ˛ Evacuation orde rs M-3120 2-4690 2, M -3120 2-70685, and M -3120 2-8 2756 201 (C) Instructing civilians to evacuate to areas that were attacked soon after 98 Evacuation orders have als o directed civilian s towards districts which were subjected to airstrikes or military activit y shortly afterwards (s ee Figure 3.46 )."
Location,"99 On 7 July 2024, multiple blocks in Gaza Cit y were ordered to evacuate west (s ee Figure   3.63 [Map ID: M4070740993]). Less than 24 hours later, families were reportedly besieged by the Israeli military in the same area they were told to evacuate to."
Location,43 Data published by the ISW on 8 July 2024 showed the Israeli military invade d the same area that it had instructed civilians to evacuate to the day b efore (s ee Figure   3.64 ).
Location,Data published by t he ISW on 8 J uly show t hat t he area civilians were previously directed to was invaded by t he Isr aeli military.
Location,"45 We con˚rmed that the famil y of Dr Hassan Hamdan, who followed the order and evac uate d f rom Khan Youni s to their relative™s home in Deir al-Balah in the ‚humanitarian zone™, was attacked the following day, and at least 12 members of the family were killed."
Location,47 The order in structe d Palestinian s in the se neighbourhoods to evac uate to the ‚humanitarian zone™ in al-Mawasi through Salah al-Din Road.
Location,"Approximately 11 hours later, online rep orts emerged about attacks in al-Mawa si overnight and the further advance of Israeli ground forces in the area."
Location,"48 ˛ ‚Youn is Tirawi | ±çíó on X: ﬁFurthe r to the Sudde n Incursion into Muwasi in Kh an Youn is. Israeli Mi litary Re p ortedly Bombed [@MSF]™ <https: //x.c om/ytirawi/s tatus/1760027114516918 424> ac cessed 26 Se pte mbe r 2024.; Dia a Mahmoud, ©íã£”ó¿ [@Dia aMahmoud], ‚Israeli Tanks and Bull doze rs Reached AlMawasi Area in the Wes t o f Kh an Youn is, Cove red by Warp lanes. Te ns o f Exp l osions Are Being Heard and Seve ral Bui l dings We re Hit.™ <https: //x.c om/Dia aMahmoud/s tatus/17600 23761225691520> ac cessed 26 Se pte mbe r 20 24."
Location,"On 1 Jul y 2024, the Israeli military i ss ued an evacuation order instructing Palestinians in l arge parts of eastern Khan Younis to evacuate to t he ‚expanded humanitarian zone™. We veri˚ed t hat one of the families t hat followed t hat order was killed t he next day inside t he ‚humanitarian zone™."
Location,"206 (D) Issuing evacuation orders after having already begun military operations within the area in question (a) On 22 January 2024, the Israeli military ground invasion proceeded into west Khan Youni s cit y and into the ‚humanitarian zone™, although thes e areas had not received any evacuation orders. Th e evacuation order (for blocks 107, 112, 110, 109, 111, an d 108) came on e day after the ground invasion, on 23 January."
Location,"49 During the di˜erent phases of the evacuation orders , Palestinians in Gaza were instructed to evacuate to areas that later received another evacuation order."
Location,"103 On 19 February 2024, UNRWA linked Israe li military attac ks, evacuation orders, and mass civilian displacement more directly by stating that ‚ongoing hostilities, evacuation orders issued by the military, an d the constant n eed for safer locations have re sulted in people being displaced multiple times.™ 50 Relatedly, on 20 February, OCHA reporte d that ‚since 7 October 2023, about 6 7 percent of the Gaza Str ip have bee n p la ced und er evacuatio n orde rs™ Œ the reby maintaining the present conditions of mass displacement, as civilians are unable to return to their homes."
Location,"51 104 Alre ad y in the ˚rst phase of the evac uation orders, outlined ab ove , Pale stinian re sident s in the nor thern areas of Gaza were instructed to go to the areas south of Wadi Gaza, including the refugee camps in the middle of G aza (Wusta) and Khan Youni s. Tho se same areas later re ceive d evacuation orders from the Israeli military."
Location,"52 Later, on 29 January 2024 , the very same areas rece i ved an evac uation order instr uctin g alre ad y displaced civilians to relocate further towards Deir A l-Balah."
Location,"53 106 In s ome cas es, Palestinians were instructed to evacuate to an area and then ordered to evacuate from it the following day."
Location,"53 ˛ Map ID: M-40129-62749 54 ˛ Map IDs: M-40707-40993; M-40708-49227 207 108 T he same pat tern continued even in the ‚humanitarian zone™, as two consecutive evacuation orders on 15 and 16 August 2024 instructed Palestinians to go to an area in the ‚humanitarian zone™ on 15 August and then instructed them to evacuate from it the following day, 16 August (s ee Figure   3.68 )."
Location,"2 10 (F) Instructing civilians to displace to areas that had recently received evacuation orders 109 Civilians were directed by evacuation orders to relocate into are as that had th emselve s rece ived evacuation orders less than 24 hours prior, as illustrated in the example below. On 2 December 2023, neighbourhoods in the vicinity of al-Fukhari were instructed to evac uate towards Rafah (see Figure  3.69 )."
Location,"2 13 (G) Failing to specify the duration or expiry of evacuation orders 111 It was not clear to civilians in thes e areas how long an evacuation order remained active, or when it may have expired."
Location,"112 For example, an area near al-Nus eirat received evacuation orders bet ween 22 December 2023 and 8 January 2024, triggering a signi˚cant displacement towards the designated destination areas in Deir al-Balah and Rafah. As a result of subs equent attacks in thes e destination areas, and the absence of additional evacuation orders for al-Nuseirat, displaced families began to return in February 2024. This was followe d by Israe li military airstrikes in the area, resulting in civilian casualties among thos e who had returned. We veri˚ed the killing of t wo Palestinian women on 10 February 2024, a few days after they had returned to al-Nus eirat from Rafah, and received witness testimony and footage con˚rming the  same."
Location,"2 14 (H) Displacing civilians to destination areas that were previously targeted and destroyed 1 15 Ci vilians have been repeatedly displaced to areas with insu˜icient es sential services as a result of previous airstrikes or military activit y. On 6 May, Palestinians were ordered to move to the al-Mawasi ‚humanitarian zone™ after many of its buildings had already been destroyed or damaged. UNOSAT data, veri˚ed by our own analysis, suggests that the total number of buildings completely destroyed in al-Mawasi was 6 ,250, with 2,940 being s everely damaged, a further 8,526 moderatel y damaged, and over 4,000 identi˚ed as possibly damaged."
Location,1 16 Eac h of the six hospitals located within the ‚exp anded humanitarian zone™ have been forced out of service at di˜erent times since 7 Octob er 2023; four out of six were out of servic e at the beginning of May.
Location,"1 17 According to data from Gaza™s C oastal Municip alit y Water Utilit y (CMWU) datas et and veri˚ed by our analysis, by the end of May 2024, 61% of all water infrastructure located within the ‚humanitarian zone™ was damaged or de stroyed (67% of it s water wells, 56% of it s water tanks, 36% of it s de salination plant s)."
Location,"1 18 The 6 May boundary of the ‚humanitarian zone™ included 19 s q km of agricultural land. By the end of June, 11 s q km or 56% of this agricultural land was destroyed. Furthermore, 48% of the greenhous es within this ‚humanitarian zone™ were either damaged or destroyed by the end of June, leaving the area lacking basic  amenities."
Location,"1 19 Infra struc ture such a s the 765.67 km road networ k in the ‚humanitarian zone™ has also sustained signi˚ c ant damage, with 86.7 km destroye d, 35.75 km s everely damaged, and 233.36 km moderately damaged."
