Type,Details
Incident,A  Spatial  Analysis  of  the  Israe li Military™s  Conduct  in Gaza  since  October  2023 Report by Forensic A rchitecture 15 th Oct ober  2024 Contact: info@foren sic-architecture .org Contents 1.  Introduction 3 2. Sp atial C ontrol 48 3. Displacement 117 4. Destruction of Agriculture and Water Res ources 240 5.  Destruction  of  Medical  Infrastructure 337 6.  Destruction  of  Civilian  Infrastructure 50 5 7. Targeting of A id 720 8.
Incident,"5 Across our inves tigative research , we emp loy a suite of methodo l ogies in s patial and archi tec tural analy sis, op e n-source investigation , digital mo delling, and w itness interviewing using three-dime nsional digital mo dels (sp eci˚c methodologies applied in respect of this report are outlined in the methodology section below, and further, where necessary, in each chapter). We reconstruct incidents, including incidents of IHL and human right s violations, violations of the Genocide Convention, as well as conducting large-scale analysis of patterns of violations a cross larger terr itories and per iod s, by examining and analysing evidence obtained elsewhere."
Incident,"14 Data exported from the GCD has constituted the basis of s everal reports we have published since October  2023,  including: (a) Inhumane Zones : An assessment of Israel™s a ctions with respect to the provision of aid, shelter, safe p assage, and assistance to evacuees in Gaza; respons e to questions rais ed in the ICJ on 17 May 2024 (pub. 19 May 2024) 3 (b) Attacks on Ai d in Gaza : Preliminary Findings (shor t stud y and interacti ve platform , pub. 26 A pr  2024 ) 4 (c) Mass Burials at al-Shifa Hospital (short study, pub. 10 A pr 2024) 5 (d ) Israel™s Ecocide in Gaza (video  investigation,  pub.  2 9  Mar  2024) 6 (e) Humanitarian V iol e nc e : Israel™s Abuse of Preventative Measures in its 2023˝2024 Genocidal Military Camp aign in the Occupied Gaza Strip (pub. 7 Mar 2024) 7 (f) A n Assessment of Vi sual Material : Pres ented by the Israeli Le gal Team at the International C ourt of Justice (ICJ), 12 January 2024 (pub. 26 Feb 2024) 8 (g) Israeli Disinformation : A l-A hli Hospital (short study, pub. 15 Feb 2024) 9 (h) Destr uction  of  Medical  Inf rastr ucture  in  Gaza: (interactive plat forms, pub. 20 Dec 2023) 10 3 ˛ ‚Inhumane Zones: An Assessment of Israel™s Actions With™ (Forensic Architec ture, 2024) <https: //content.forensic-architec ture.org/ wp-c ontent/uploads/2024/05/Inhumane-Zones-Rep ort-Forensic-Architec ture_WEBSITE.p df> ac cessed 12 September 2024 4 ˛ ‚ Attacks On Aid in Gaz a: Prelimin ary Findings , Forensic Architec ture ™ <https: //fore nsic-architec ture.org/inves tigation/at s - tacks-on-aid-in-gaz a-prelimin ary-findings> ac cessed 28 Se pte mbe r 2024."
Incident,"17 FA™s provi sion of thi s report to South Africa follows the report s it has previousl y provided to South Africa: (a) Inhum an e Zones: An asses sment of I srael™s actions with respect to the provis ion of aid, shelter, safe p assage, and assistance to evacuees in Gaza; respons e to questions rais ed in the ICJ on 17 May 2024 (pub. 19 May 2024) (b) A sp atial analysis of Israe l™s conduct in Rafah and across Gaza since the International C ourt of Justice Order for the Modi˚cation of Provisional Measures (submitted 5 September 24) 7 C˜ SCOPE 18 This report aims to pres ent p atterns of ‚incidents™ Œ that is, attacks or acts of destruction committed by the Israeli military Œ within the area of the occupie d Gaza Strip (hereafter ‚Gaza™) betwe en 7 October 2023 and 16 September 2024. The se incidents include att acks on home s, shelters, hospitals, and other medical facilities; public institutions such as universities, schools, and government buildings; places of c ultural signi˜canc e such as c emeterie s, archaeological sites, and mosques; agricultural infrastr ucture such as ˜elds, orchards, greenhouses, and water wells; and infrastructure for the transport, storage, and  distribution  of  aid."
Incident,"21 The repor t seeks to identif y ‚pattern s™ within the se act s of violenc e , by which we me an the order of repetition of same, similar or related incidents , at di˚erent times and places . Such pat terns m ay indicate that thes e attacks are designed, formally or informally, rather than occurring at random or in a haphazard way. Pattern analysis is derived from the colle ction and veri˜cation of individual incidents."
Incident,"Our databas e is made up of all incidents we have collected and veri˜ed (s ee veri˜cation framework below) bet ween 7 October 2023˛11 October 2024. While our datas et of incidents is limited by what we were able to verify within the timeframe provided, our analysis of this datas et demonstrates clear p atterns of speci˜c military conduct and practices repeated over time and through space; we outline these patterns as ˜ndings in each of the areas of study. FA uses its professional expertise to determine the presence of pat terns but does not m ake determinations beyond those patterns directly observable from the data, nor does it make legal inferences or legally evaluate its ˜ndings."
Incident,"23 The GCD all ow s us to s tu dy and prese nt patter ns related to all do cumented and ve ri˜ ed incid ents relate d to a single category of attack Œ for example, targeting of aid, destruction of me dical infrastructure, or environmental destruction Œ across the entire territory of Gaza  bet ween October 2023 and June 2024. Importantly, the GCD allows u s to study relations between incidents of m ore than one category."
Incident,This enables us to consider whether relations exist bet ween di˚erent t ypes of attack.
Incident,"12 27 We consider attacks on civilians to be any act of violence against the civilian population and civilian obje cts, whether in o˜ence or in defence, even if the attack does not lead to the death or injury of civilians."
Incident,"12 ˛ ‚Attacks on Civi lians and Othe r Unlawful Ki llings, and Attacks on Civi lian Objec ts | Gl obal Protec tion Clus te r™ <https: //gl obalprotec tion - cluster.org/index.php/Attacks _on_Civilians> ac cessed 14 September 2024."
Incident,"13 ˛ ‚Attacks on Civi lians and Othe r Unlawful Ki llings, and Attacks on Civi lian Objec ts | Gl obal Protec tion Clus te r™ <https: //gl obalprotec tion - cluster.org/index.php/Attacks _on_Civilians> ac cessed 14 September 2024."
Incident,"5˜ Destruction of Medical Infrastructure Œ including targeting of hospitals and other medical infrastructure, or otherwise forcing medical facilities out of operation, and the targeting of healthcare workers."
Incident,"6˜ Destruction of Civilian Infrastructure Œ including the targeting of schools, mosques, and government buildings."
Incident,7˜ Targeting of Aid Œ including the targeting and destruction of infrastructure and personnel necessary for the transport and distribution of humanitarian and food aid.
Incident,10 E˜ CONTEXT 30 Our p attern analysis extends beyond the establishment of relationships between contemporaneous incidents and s eeks als o to examine relationships to incidents across the region™s history.
Incident,"36 56 Th e system an d inf rastructure of the block ade were used to enact the pre sent siege of 2023˝2024 (s ee Chapter 7: Targeting of A id). This is made explicit in Prime Minister Netanyahu™s 18 October 2023 state ment: ‚we will not all ow humanitarian a ssistance in the form of foo d and medicines from our territory to the Gaza Strip.™ In mid-January 2024, after international pressure, Netanyahu returned to a policy of strictly regulated aid bas ed on Israel™s interpretation, nowhere internationally accepted, of what constitutes the humanitarian minimum in Gaza."
Incident,"Since the end of 2023, this dune area was designated by the Isra eli mili tar y as a ‚humani tarian zo ne™ fo r disp laced peo pl e, d es pite lacking alm os t any infras tru cture to sup p ort the numbe r of p eo ple dis placed there. Even after Is rael designated the area a s a ‚humanitarian zone™ it was continuously targeted from the air and invaded by the Israeli military on the ground (s ee Chapter 3: Displacement). Survival in this zone p artially relied on Palestinians reverting to the area™s traditional ways of obtaining water by digging wells following the traditional al-Mawasi system."
Incident,"75 This design aim ed to segregate the targeted pop ulation in a designated spa ce whose per im eter was controlled, sometimes fenced, or otherwise secured. Entry and exit into this space were also controlled. The treatment of p eople within these zones was markedly di˜erent from those in surrounding areas."
Incident,"We showe d that a recurrent element in genocide is displacement. To generate displacement, the perpetrators often de stroy the life-sustaining environment from which it seeks to displac e the targeted population. By destroying the means that sustain the biological, cultural, and political life of the targ eted populatio n , the pe rpetrato rs fo rced the targeted groups to leave. The d estruc tio n and transformation of the environment was often als o undertaken to prevent the return of survivors to the area from which they were originally driven out."
Incident,"80 Collection : We collect information from a variety of media formats that include recorded videos, photographs, satellite and remote-sens ing im agery, written and oral testimony, and text-based reports of incidents Œ from three t ypes of s ources: (a) Using open-source research methodologies (see OSI below) (b) Sent to us directly from individual s ources (s ee Credibilit y below) (c) Datas ets shared with us by trusted organisations in our ˚eld (s ee Credibilit y below) 81 Veri˚cation: In relation to (a) and (b), materials are veri˚ed according to the veri˚cation f ramework outlined below. In relation to (c), we examine the third party™s data-gathering methodology and sample th e dat aset to determin e that th e dat aset meets our st an dards. If we deem it n eces sary, we investigate the  ˚le  using  veri˚cation  s oft ware  (s ee  ‚veri˚cation  and  interpretation™)."
Incident,"82 Interp ret ation: Interpretation is the process of reading what the data pertaining to a p articular incident tells us. For text-bas ed materials, this means deriving the details of an incident, including its location, time, and context. Where necessary, our res earchers corroborate the claims of an incident with visual eviden c e found in footage or satellite imagery, which may capture the incident or its aftermath (see ‚veri˚cation and interpretation™). For visual mater ials, this involves c lose analysis of what is ‚in the frame™, and what is implied ‚outside the frame™ by the contents of the frame. This process varies depe nding on case c ontext. It c ould inc lud e ide ntifying the unifo rm s of sol dier s o r civil society pe rsonnel, id entifying the pres ence of emergency s ervices, or identifying any weapons or munitions (or munition fragments)."
Incident,"Through examining these and other features, our researchers piece together what can be understood of what has unfol d ed w i thin the incid ent c aptured by a piece of m edia. Co mm o nly, the p ro cess of interpretation al so involves cross-referen cing between th e subject dat a an d oth er data apparently pertaining to the same incident. This process ends by providing a written description of the incident, which is stored within our incident databas e and subs equently the GCD."
Incident,"8 3 Mapping : Once an incident is considered to have been veri˚ed, either as ‚con˚rmed™ or ‚most likely™, we enter that incident into our databas e, categorising and labelling it to include information such as sources , time of incident, location of incident. Each incident is given an identi˚cation number (‚ Incident ID™) compri sed of the abbreviate d date of the inc ident and a unique code (Y MMDD12345). These IDs are cited and footnoted where the relevant incident is mentioned in the report, s o that it can be directl y corroborated with information per taining to it in the database. All incident s that are referenc ed 25 in the body of the text are liste d in the appendix of the chapter in which they appear, along with their p rimary source info rmation. Additio nal source info rmatio n c an be found in the GCD. Incide nt data is also pull ed into the GCD™s c arto grap hic inte r fa ce, w he re i t c an be analysed in relatio n to othe r incidents in sp ace and time. Incidents which are mapped in ˚gures throughout the report are in the GCD along with their s ource materials."
Incident,"52 In the cas e of most of thes e X/ Twitter posts, the video or image its elf, in combination with other image data pertaining to the same incident, drawn from other posts, contains information su˜icient to determine the location of the airstrike as indeed within the al-Mawasi ‚humanitar ian zone™. Further, the ima ge, in combination with satellite ima gery from the days before and after, contains information su˜icient to determine that the airstrike indeed occurred on the day claimed Œ at the coordinates determined by the process of geolocation, there is no crater visible on 9 Septemb er 2024, but a crater is visible in imagery captured on 10 September 2024. The image, and other ass ociated image data, does not in its elf contain enough information to determine that 1 9 civilians died in the strike, a s wa s rep orted by Gaza™s health ministry."
Incident,"53 However, that 52 ˛ Incident ID: 40910-91667 53 ˛ Beth an McKe rn an, ‚Kh an Youn is Saf e Zone : Israel Launches Deadly S trike on al- Mawasi, Gaz a Of ficials Say™ The Guardian (10 Se pte mbe r 2024) <https: //www.theguardian.c om/worl d/articl e/2024/se p/10/kh an-younis-israel-s trike-al-mawasi-tent-camp-gaz a- deaths-humanitarian-s afe-zone> ac cessed 27 Se pte mbe r 2024."
Incident,"88 A second example: a video p osted online on 29 February 2024 claims to show the aftermath of an attack on a group of civilians waiting to receive aid from a truck at the al-Nabulsi roundabout, near the Netzarim corridor. The video contains information su˜icient to determine that the incident took place at the claime d location. The content of the original vide o i s not imme diatel y, full y, and straightforwardl y clear, and thus a process of careful interpretation of the video™s content begins. T hat process of interpretation may involve cross-referencing the content of this video with other videos and images of the same incident from di˜erent angles Œ a process which requires that thos e videos are thems elves geo - and chronolocated and interpreted. (In this way, it is evident that veri˚cation and interpretation of multiple images and videos may occur simultaneously; image and video s ources may be mutually s upporting.) The original image and video may also b e cross-referenced with repor ts from news organisations, independent journalist s, and NGOs, until such time Œ as in this example Œ that to th e best of our res earchers™ understanding, the incident can be fairl y described as claimed: as an attack on  civilians  waiting  for  aid  distribution."
Incident,"89 As the examples ab ove demon strate, veri˚cation i s a process which responds to, and is determined by, the available  evidentiary  material,  and by  the question s  that  are aske d  of  that  material, and  the obje ctive of the process: what about the material is a res earcher s eeking to verify? The process of veri˚cation is not (or not only) a set of yes/no questions; the processes of ver i˚cation and interpretation often overlap. Further, in s ome cas es, we have found that while the incident transpired almost as described in the ass ociated claim, the claim in s ome respects varied from or exceeded what can be known by the contents of the image/video material, and any ass ociated and credible reports."
Incident,"90 In this c a se c ontext , the result of the p rocess of ve ri˚c atio n and inter p retatio n is that an incid ent is clas si˚ed as con˚rmed , most likely , or unkn own (see below). That classi ˚cation is the result of th e processes describ e d ab ove, or of an inc ident having b e en reporte d by a credible s ource (se e Cre dibility below). Three categories of classi˚cation are de˚ned as follows: (A) Con˚rmed 9 1 In our professional ass essment, this incident occurred as described by the ass ociated claim."
Incident,"92 A n incident is classi˚ed as ‚con˚rmed™ if : (a) the re is image/vid eo mate r ial d o cumenting the incid e nt w hich has been g eo l oc ated and chronolocated, and the content of the material corresponds to the ass ociated claim OR (b) there is image/video material documenting the incident which has not been geolocated and/ or chronolocated, but at least one credible s ource has reported on the same incident OR (c) there is no image/video m aterial capturing the in cident, but it has been reported by a credible  source 27 (B) Most likely 93 In o ur professional assessment, this incident is most likely to have occurred as described by the associated claim."
Incident,"94 A n incident is classi˚ed as ‚most likely™ if : (a) there i s image/vide o material documenting the incident which has not b een ge olocate d and/or chronolocated OR (b) it has not been reported by a credible  source (s ee  de˚nition  below) BUT (c) there is visual evidence pertaining to the potential incident via satellite imagery (C) Unknown 95 In o ur profess ional assessment, insu ˜icient im age/video m aterial or insu ˜ icient credible so urces exist to con˚rm with any con˚dence a given claim."
Incident,"96 A potential incident is classi˚ed as ‚unknown™ if : (a) there is no image/video material documenting the incident AND (b) there are no reports by a credible  source AND (c) the potential incident or its aftermath is not visible in satellite imagery (D) Credibility 97 A process of ‚source analysis™ is used to establish whether an online source shoul d be considered credible, drawing on best practice guidelines for the ˚eld, including the B erkeley Protocol on Digital Open- Source Investigations (the ‚B erkeley Protocol™), and in line with established practices of other agencies in our ˚eld (including B ellingcat, Mnemonic, the Global Legal Action Net work, and A irwars, among  others)."
Incident,"101 As de scribed above, each recorded incident is collected, veri˚ed, geolocated, timed, and tagged."
Incident,"This allows for a high multiplicity of incidents to be cross-referenced and studied in relation to eac h other. Our res earchers us e the GCD to move across di˜erent levels of analysis and identify relations betwee n incidents , patterns , and rep eti tions of ac ts of v iol ence across the entire te rri tor y of Gaza and throughout the duration of the con˘ict. The GCD is conceived as both a tool of res earch and as a tool of presentation ,  allowing  the  extraction and  pres entation  of  multiple  evidentiary  threads ."
Incident,"102 The GCD is a car tographic doc umentation of actions conducted by the Israel Defenc e Forc e s (henc efor th ‚the Israe li military™ or ‚the military™) in Gaza since October 2023, including aerial bombardment, shootings, artillery strikes, bulldozing, and demolition, organis ed as discrete ‚incidents™, but arranged in s uch a way that pattern s and relation ships b etween inc idents may b e di scerne d. Within the interface of the GCD, us ers can delineate a geographic region, a time period, or both, and retrieve information about all incidents we colle cted within that delineated domain. In this way, the GCD provides res earchers with the raw data with which to anal yse relation s and potential pattern s b etwe en inc idents. All inc idents are recorded in local time (Gaza), and place names are translated into English."
Incident,56 107 All incidents analysed and mapped can b e found in the GC D online.
Incident,Source s for factual averment s within this report which are not part of our incident databas e (GCD) follow the following criteria: text repor t s about event s follow the veri˚cation framework™s credibility criteria; the use of open-sourc e footage  follows  the veri˚cation  framework™s  standards  for  authenticit y  and  geolocation;  all  statistics come from reputable and established organizations and experts.
Incident,"3.2 Geolocation 1 10 Geolocation is the technique by which researchers can determine the precise place at which an incident occurs. A de˚nition is provided in the Berkeley Protocol on Digital Op en Source Investigations: 111 ‚Geolocation  is  the  identi˚cation  or  estimation  of  the  location of  an  object,  an  activit y or  the  location from which an ite m was generated. Fo r example, it may be possible to deter mine the location from which a video or photograph downloaded from the Internet was taken using geolocation techniques."
Incident,"33 can be overlaid on contemporary satellite imagery to view chan ge s over time for a given region, for example, to study a neighbourhood undergoing prolonged aerial attacks , or the degradation of vegetation in a ˚eld."
Incident,(b) The checkpoints exclusively allow for one-way movement by civilians from the north to the s outh (s ee Chapter 3: Displacement) and aid from ‚s outh™ to ‚north™ (s ee Chapter 7: Targeting of  A id).
Incident,"58 2.8 The territorial arrangement imposed on Gaza through the abovementioned elements is key to understanding other dimensions of Israel™s military campaign, such as the destruction of agriculture, the displacement of civilians, and the targeting of aid in par ticular areas (see Chapter 58 ˛ ‚Israeli Minis te rs Join Ultran ation alis t Confe re nce Urging Gaz a Resettl e me nt,™ Reuters (29 January 20 24) <https: //www.reu te rs.c om/ worl d/middl e-eas t/israeli-minis te rs-join-ultran ation alis t-c onfe re nce-urging-gaz a-resettl e me nt-2024-01-29/> ac cessed 26 Septe mber 20 24.; See also App e ndix: S tudy o f the relationsh ip betwee n Israeli public s tate me nts and Israeli mi litary c onduc t in the o c cupied Gaz a s trip."
Incident,"36 3: Displacement, Chapter 6: Destruction of Civilian Infrastructure, Chapter 4: Destruction of Agriculture and Water Resources, and Chapter 7: Targeting of Aid)."
Incident,"(e) According to data publi shed by the UN, 346 schools were use d as shelters, 70% of them were attacked."
Incident,38 2˜ Pat tern ˚n dings 2.1 The Israeli military has continuously attacked all areas of Gaza such that no place can reasonably be considered safe.
Incident,"1 17 The Israeli military has attacked: (a) Destination  areas,  including  the  ‚humanitarian  zone™ (b) Israeli  designa ted ‚safe  r outes™ (c) Unde˚ned areas, including civilian shelters (d ) Civilians from within evacuation areas 2.2 Destination areas have decreased in size, even as the displaced population has increased."
Incident,2.3 The Israeli military™s use of evacuation orders has put civilians at risk by: (a) Issuing  inconsistent  and  incomplete  information  about  the  ‚humanitarian  zone™ (b) Issuing unclear and inconsistent evacuation orders (c) Instructing civilians to evacuate to areas that were attacked s oon after (d ) Issuing evacuation o rde rs af te r hav ing alrea dy begun mili tary operations within the area in question (e) Issuing a s equence of evacuation orders that displaced civilians multiple times (f) Instructing civilians to displace to areas that had recently received evacuation orders (g) Failing to specify the duration or expiry of evacuation orders (h) Displacing civilians to destination areas that were previously targeted and destroyed 2.4 The Israeli military besieged displaced civilians and funnelled them into checkpoints where they were surveilled.
Incident,61 (b) 31 of 36 hospitals have been targeted by Israeli military attacks.
Incident,"(g) 1 hospital (Patient™s Friends Societ y Hospital) has been attacked and forced out of s ervice t wice, having rebuilt and reestablished operations."
Incident,"60 ˛ Many hospitals and fiel d hospitals h ave bee n attacked multip l e times and in dif f e re nt f orm s, and as such are ac c ounted f or in multip l e categories of the quantitative findings."
Incident,41 2˜ Pat tern ˚n dings 2.1 The Israeli military repeatedly targeted medical infrastructure across Gaza.
