Type,Details
Incident,"711 712 1.17 Incident IDs ID Date Latitude Longitude S ources Geoloc ation by 40903-59006 2024-09-03 31.282948 34.249763 https://x.com/ytirawi/ s tatus/1830728825933824378 OSINT 31010-53523 2023-1 0-1 0 31.248635 34.257464 https://x.co m/i dfo nline/ status/171172 1465194680554 OSINT 31016-68401 2023-1 0-1 6 31.247812 34.2572 33 https://x.c om/Sinai fhr/ status/1713964959942557781 OSINT 31 014-972 1 3 2023-1 0-14 31.2481874 34.2571561 https://x.co m/Osinttechni cal/ status/1713107080712782 170 OSINT 40507-82991 2024-05-07 31.24834 34.259821 https://x.com/kann _news/ status/178773694609084462 1 OSINT 40617-85007 2024-06-17 31.248138 34.259796 https://x.com/ytirawi/ status/1802483120601485529 OSINT 40619-24142 2024-06-1 9 31.247893 34.259805 https://x.com/Doron _Kadosh/ status/1803323819861455149 OSINT 40612-92910 2024-06-12 31.247961 34.260265 https://x.com/ytirawi/ status/1800841913349894346 OSINT 402 12-67287 2024-02-12 31.282948 34.249763 https://x.com/Hind_Gaza/ status/1756869279385788851 OSINT 40114-78720 2024-01-14 31.481689 34.408695 https://x.com/ytirawi/ status/1776047020811141402 OSINT 31204-1 9472 2023-12-04 31.478454 34. 411254 https://x.com/no_itsmyturn/ status/1731671802705826208 OSINT 40507-91680 2024-05-07 31.279272 34.253391 https://x.com/AlQastalps/ s tatus/178792792 1 077674323 OSINT 40807-70569 2024-08-07 31.279272 34.253391 https://t .me/amitsegal/36987 OSINT 408 22 -95472 2024-08-22 31.279272 34.253391 https://www.face - boo k.co m/murafah/ videos/8310824809004769/ OSINT 31114-74766 2023-11-14 31.348311 34.302747 https://x.c om/zl_at47051/ status/1724544847640478023 OSINT 31115-47485 2023-11-15 31.348311 34.302747 https://x.c om/Palpos tN/ s tatus/172472751 0615609692 OSINT 40224-39086 2024-02-24 31.348311 34.302747 https://x.com/ytirawi/ s tatus/177599867852 1495867 OSINT 40604-83642 2024-06-04 31.499181 34.436693 https://x.co m/RamAbdu / status/17979539268573923 05 OSINT 40612-28497 2024-06-12 31.497919 34.43566 https://www.facebook.c om/ KuffiyaT/videos/a-video -shows- the-hellish-destruction-in-the- vi cinity-of-ga z as-university-col - leg/7943632 19491342/ OSINT 40803-09322 2024-08-03 31.497919 34.43566 https://x.com/QudsNen/ status/1819674320391553125 OSINT 31 009-2 1 9 39 2023-1 0-09 31.246861 34.255275 https://x.co m/m _ osint / s tatus/1711428379675631764 OSINT 31010-25053 2023-1 0-1 0 31.248342 34.259032 https://airwars.o rg/civilian-ca - sualties/ispt0086-octo - ber-1 0-2023/ Airwars 31010-42259 2023-1 0-1 0 31.25148 34.262103 https://x.c om/EjShahid/ status/1711752 140039807293 OSINT 31 014-47375 2023-1 0-14 31.40916587 34.35055316 https://airwars.o rg/civilian-ca - sualties/ispt0241a-octo - ber-14-2023/ FA 31014-26312 2023-1 0-14 31.42494 34.377314 https://airwars.o rg/civilian-ca - sualties/ispt0200-octo - ber-14-2023/ FA 71 3 ID Date Latitude Longitude S ources Geoloc ation by 31015-79917 2023-1 0-15 31.28726009 34.24817087 https://airwars.o rg/civilian-casu - al t ies/ispt 0227- october-15-2023/ FA 31015-60 690 2023-1 0-15 31.450065 34.392934 https://airwars.o rg/civilian-ca - sualties/ispt0239b -octo - ber-15-2023/ Airwars 31016-74899 2023-1 0-1 6 31.450065 34.392934 https://airwars.o rg/civil - ian-casualties/ispt0248-octo - ber-1 6-2023/ Airwars 31016-40407 2023-1 0-1 6 31.333847 34.296719 https://www.facebook.c om/ elakkad.m/pos ts/pfbid0jRE3c - 9ZmWMpv 6zKCtDb6z - aBUfzZh6HnBFAEzjwYdJxP - 8WVWkGtvdNi gWzhpdYc22l Airwars 31016-53703 2023-1 0-1 6 31.310318 34.241843 https://t .me/Gaz aN - ewsNow/253842 Airwars 31016-52 192 2023-1 0-1 6 31. 437817 34.388418 https://www.facebook.c om/ Ppostps/p osts/pfbid02mG2q - xNSHrnQYhr4JmxFWXUBEMB - jSXd1pWUFG AQbmhyY3kAgV - V29WJVg2HMj5UW f6l Airwars 31 017-32 111 2023-1 0-17 31.34548584 34.30043835 https://airwars.o rg/civilian-ca - sualti es/ispt0332e-octo - ber-17-2023/, https://t .me/ ShehabTelegram/406438 FA 31 017-73449 2023-1 0-17 31.408654 34.3532 14 https://airwars.o rg/civil - ian-casualties/ispt0285-oc - to ber-17-2023/, https://t .me/ ShehabTelegram/406206 Airwars 31 017-96266 2023-1 0-17 31.288347 34.250999 https://airwars.o rg/civil - ian-casualties/ispt0290-oc - to ber-17-2023/, https://t .me/ ShehabTelegram/406129 FA 31017-91074 2023-1 0-17 31.3614983 34.2927371 https://airwars.o rg/civil - ian-casualties/ispt0283- octo ber-17-2023/, https://t ."
Incident,Table of incidents cited in Sect ion.
Incident,"715 71 6 717 718 71 9 7. Targeting of Aid 1 In this chapter, we analys e incidents, and p attern s of incidents, in which the Israeli military obstructed or attacke d sites and systems for the provi sion and re ceipt of humanitarian aid, aid personnel, and civilians seeking aid."
Incident,"1 3 Escalated attacks: We use the term ‚escalated attacks™ to refer to a signi ˚cant increase in the rate of attacks obse rved fo r a give n aid categ or y. This is d eter mined by cross-referencing the tim e and location of all re corded incidents with one another, along with contextual research ab out a given period."
Incident,"4 Vigilante: We us e the term ‚vigilante™ in this chapter to refer to Israeli civilians who have acted, without o˜icial state instruction, to attack or disrupt aid routes and aid convoys destined for Gaza."
Incident,5 Decon˙icted : A site whose operation s and coordinates have b e en coordinate d with the Israeli authorities to protect and exempt it from military targeting.
Incident,72 1 B˜ SUMMARY OF FINDINGS 7 Our analysis of incidents in which aid was attacked indicates that the Israeli military repeatedly targeted aid across Gaza since the Israeli military campaign began in October 2023. The repeated nature of such attac ks suggests that they were not random.
Incident,1˜ Quantitative ˜n dings 1.1 We documented 322 incidents of aid-targeting between 7 October 2023 and 16 September 2024.
Incident,"Of which: (a) 17 attacks were on bakeries (b) 73 attacks were on shelters for displaced Palestinians, such as UNRWA-run schools, where food aid was received and distributed (c) 60 attacks were on aid pers onnel (d ) 50 attacks were on civilians seeking aid Œ 37 of these occur red just north of the Netzarim corridor between January and March 2024. (More civilians were killed in attac ks which we have classi˜ed as attacks on other targets.) (e) 78 attacks were on aid infrastructure, such as warehous es and water treatment facilities (f) 22 attacks were on convoys of trucks transp orting aid through Gaza, which were coordinated by  humanitarian  aid  organisations (g) 6 attacks were on aid convoys en route to Gaza through Israel or the occupied West Bank, carried  out  by  Israeli  vigilantes  during  May  2024 (h) 16 attacks were on markets where aid was being obtained by civilians (i) At least 17 of the attacks on aid pers onnel, convoys, and infrastructure targeted sites involved in operations that had been o˚icially coordinated with Israe l and recognis ed as ‚decon˛icted sites™, understood to be exempt from Israeli military targeting, or ‚safe™."
Incident,"1.2 We documented the following attacks on aid sites and systems operated by UNRWA: (a) Among the attacks on aid p ersonnel, convoys , and infra structure, at lea st 39 were on UNRWA personnel, facilities, or vehicles."
Incident,"722 2˜ Pat tern ˚n dings 2.1 Our analysis indicates that the Israeli military targeted sites and systems of aid distribution when and where they became the main mode of aid facilitation. We observed that this targeting followed a pattern of overlapping phases, during which attacks on the speci˛ed aid categories intensi˛ed: (a) Octob erŒNovemb er 2023: Bakeries in the north of Gaza were targeted when they played a critical  role  in  aid distribution, during October and early Novemb er 2023."
Incident,"(b) Octob er 2023˛Januar y 2024: She lters were targeted when they assume d a central role in housing people displaced by Israeli attacks, and facilitating the receipt and preparation of food aid, f rom 13 Octob er to Decemb er 2023."
Incident,"(c) December 2023˛February 2024: Pales tinian police o˝icers , who we cate gorise as ai d personnel , were targeted when they played a critical role in escorting aid convoys."
Incident,(d ) Januar yŒMarch 2024: Civilian s were targeted when gathering to receive aid from aid trucks that p ass ed through the Netzarim corridor checkpoints into northern Gaza f rom Januar y to March 2024.
Incident,"(f) October 2023, De cember 2023, and May 2024: Aid distribution and stor age sites , in clud ing warehouse s and market s, were targeted when they were acti vely operating to supply ci vilians with food, with severe at tacks on Rafah crossing, Karem Abu S alem/Kerem Shalom crossing, and markets during periods of increased aid- entering."
Incident,(g) May 2024: Israeli vigilantes attacked aid convoys p assing through Israel and the occupied West Bank under the watch and sometimes with direct support of Israeli military pers onnel.
Incident,"2.2 The periods after which Israel increased the ˝ow of humanitarian aid into Gaza (late December 2023; late March and early April 2024; early May 2024) coincide in time and space with an increase of Israel™s targeting of the means of distributing that aid, including the logistics, personnel, and infrastructure necessary."
Incident,2.3 The targeting of aid occurred in tandem with the Israeli military™s evacuation orders and coincides with its attempts to force Palestinian civilians to displace from the nor th of Gaza. The construction of the new internal border in the Netzarim corridor and the checkpoints within it supporting a one-way (north to south) movement of civilians coincided with the restriction of aid as a means of displacement.
Incident,"Annotated timeline of attacks ta r geting ai d a nd the p ha ses in w hi ch they occur. Each r ow dis plays a catego ry of aid att acks (e.g., att acks on aid infrastr uct ure), and it highlights a signi˜cant period , which is explained by an accompanying annotat ion. Note t hat s ome categories of attacks Œ aid infr ast ructure and aid per s onnel Œ are repeated in two dist inct rows."
Incident,"13 While the 29 Feb ruary ‚Flour Massacre™ and the 1 April att ack on the World Central Kitchen convoy are the most widely reported attacks on aid, we have documented a total of 322 attacks by the Israeli military on aid sites and systems."
Incident,14 We have previously documented the attacks on aid in an online platform at www.gaza-aid-at tacks.
Incident,"12 ˝ On 14 May 20 24, we published do cume ntation o f at l eas t 80 attacks on aid across Gaz a betwee n January and March. Our an alysis included the f o ll owing categories: attacks on aid infras truc ture; attacks on aid p e rsonnel; attacks on civi lians see king aid; and attacks on aid c onvoys."
Incident,"726 D˜ SCOPE 15 In this chapter, we examine Israel™s attacks on and impediments to various s ites and systems of aid distribution in Gaza from October 2023 to September 2024. Our analysis of thes e attacks address es the  following: (a) The frequency of Israeli attacks on aid sites and systems in sp ace and time."
Incident,"(b) How thes e attacks correlate to signi˚cant changes in the availabilit y and coordination of aid, such as the opening of border crossings and the emergence of new aid systems or groups."
Incident,"(c) The relation bet ween attacks on aid sites and systems and the displacement of Palestinian civilians,  by  way  of  restricting  the  availabilit y  of  aid."
Incident,16 The analysis considers attacks on aid in the following categories: (a) Attacks on bakeries: A ll facilities actively prep aring baked goods at scale.
Incident,(b) Attacks on shelters: A ll facilities o˜icially designated as housing displaced people.
Incident,"(d ) Attacks on aid p ersonnel : Palestinian police, public o˜ icials, members of family tribal groups , c i vilian volunte ers, and Pale stinian and international aid workers who were known to b e invol ve d in or responsible for aid delivery and s ecurit y. Attacks on aid personnel occurred at sites of aid  delivery,  receipt,  transportation,  and  storage,  and  on  vehicles  or  places  of  residence."
Incident,"(e) Attacks on marke ts: A ll facilities where commercial vendors or volunteers were distributing food,  during  their  time  of  operation."
Incident,"(f) Attacks on ai d infras tructure: Warehouses, distribution facilities, and water infra structure (not bakeries, shelters, and markets, which are already accounted for in other categories)."
Incident,"(g) Vigilante att acks on ai d: Instances where Israeli civilians disrupted aid truck convoys or attacked aid truck drivers, namely in the West Bank or in Israel."
Incident,"17 A mong thes e categories of attacks, we als o consider which of them constitute: (a) Attacks o n U NRWA: UNRWA sta˜ and employees, warehouses, and missions involved in the  distribution  of  aid."
Incident,(b) Attacks on decon˙icted sites: Facilities whose coordinates have been directly supplied to Israeli authorities to exempt them from military targeting.
Incident,"A screenshot from o ur interactive platform documenting 322 Israeli at t acks on aid for Gaza from 7 October 2023 to 1 6 September 2024 on a map (top) and in a t imeline (bottom). Attacks are categoris ed by colour: red for attacks on civilians s eeking aid; yellow for attacks on aid convoys; purple for attacks on aid personnel; or ange for attac ks on aid infr ast ructure; brown for attacks on bakeries; blue for attacks on shelter s; green for atta cks on markets; white for attacks by vigilantes on aid convoys (which are not depicted on t he map since t hey did not occur wit hin t he terr itory of Ga za). When mult iple attac ks are located in t he same gener al area, t hey are grouped toget her in pie chart ™cluster s™, where t he colour s show t he breakdown of each attack type. Note t hat s ome attac ks are visible in t he t imeline but not in the map becaus e t hey have not been assigned a locat ion."
Incident,"728 E˜ TIMELINE 19 Our analysis identi˚es the following phas es in Israel™s attacks on aid sites and systems in Gaza: 1˜ First three Weeks of bombing: 7ˆ27 October 2023 20 Following 7 October, long queues of Palestinians were seen outside bakeries. Israeli bombing destroyed bakeries, primarily in the north of Gaza (e.g., Gaza Cit y), and on three documented occasions directly after images of queues circulated online (s ee Section H1: Attacks on bakeries)."
Incident,"21 Th e Rafah cro s sing was att acked in at least three strike s between 9 October an d 1 6 October, disrupting the entry of aid from Egypt (s ee Section  H 6:  Attacks on  aid  infrastructure and Chapter 6: Destruction of Civilian Infrastructure)."
Incident,"2˜ Groun d Invasion of nor th of Gaza: from 27 October 2023 22 The Israeli military continued to attack bakeries. By late October, an estimated 600,000 Palestinians were displac ed to sh elters, which by then had begun to function as place s for receiving and distributing aid."
Incident,13 Israeli military bombing attacked shelters primarily during this period of critical reliance on them (s ee Section H2: Attacks on shelters).
Incident,"3˜ Cease˚re: 24ˆ30 November 2023 23 By the start of the temporary ceas e˚re, all bakeries in northern Gaza went out of operation, multiple water facilities had been damaged by Israeli ˚re, including the only wate r des alinatio n plant (see S ection H6: Attacks on aid infrastructure)."
Incident,14 24 Attacks on shelters continued after the cease˚re.
Incident,"4˜ Groun d invasion of south Gaza: from 4 December 2023 25 On 17 December, following the start of the ground inva sion in the south of Gaza, the Israeli military submitted to international pressure and opened the Karem Abu Salem/Kerem S halom crossing Œ a transit point for trucks located near Rafah. In the following weeks, the Israeli military attacked various aid pe rso nnel invo lved in facilitating the e ntr y a nd dis tribu tio n of aid into Gaz a, incl u ding killing the director of the K arem A bu Salem/Kerem Shalom crossing (se e Section H3: Attacks on aid pers onnel Œ police escorting aid convoys and Section H 6 Attacks on aid infrastructure)."
Incident,"729 26 Throughout January and February 2024, the Israeli military attacked Palestinian police o˜icers escorting aid convoys, compelling humanitarian organisations to halt operations (s ee Section H3)."
Incident,"28 Betwe en January and March, we documented 37 di˜erent incidents, in which the Israeli military opened ˚re on civilians seekin g aid, each time shortly after aid trucks pas sed thro ugh a Netzarim corridor checkpoint."
Incident,"2 9 Throughout March, the Israeli military attacked Palestinian c i vil society organi sation s in northern G aza , which issued statements that they were operating to facilitate aid (s ee Section H5: Attacks on aid pers onnel  Œ  aid  administrators)."
Incident,"15 6˜ ICJ Order for Additional Provisional Measures: 28 March 2024 31 Four days after the order, on 1 April, the Israeli military launched a fatal attack on a World Central Kitchen convoy. After international pressure in the wake of the attack compelled Israel to allow more aid in on 5 A pril, and 9 April subs equently saw the highest volume of aid enter since 7 October 2023, the Israeli military attacked four markets the following week (s ee Section H7: Attacks on markets)."
Incident,"7˜ Groun d invasion of Rafah: from 6 May 2024 32 On 6 May, the Israeli military invaded Rafah, destroying aid warehous es there and s eizing the Rafah border c rossing with Egypt. Subsequently, the number of aid truc ks entering Gaza fe ll to an all-time low since the total blockade in O ctober 2023. The trucks that entered mostly comprised trucks belonging to the private s ector. In May, following months of protests and blockades, Israeli vigilantes attacked aid trucks and drivers travelling to Gaza through the occupied West Bank and Israel in the pres ence of Israe li s oldiers (s ee Section H8: Vigilante Attacks on A id)."
Incident,8˜ Order for the Modi˚cation of Provision al Measures: 24 May 2024 33 Attacks on all the above-mentioned categories of aid have continued since.
Incident,"2˜ Corroborated media repor ts: (a) Reputable news sources: Incidents were further validated through reports from credible international and regional news outlets, providing additional context and veri˚cation."
Incident,3˜ Public statements (a) Statements from Israeli o˝icials and soldiers: Public declarations indicating the intentions and tactics us ed in the attacks on aid.
Incident,4˜ Testimonies: (a) Intervi ews with ai d workers and ci vilians: Firs t-hand ac counts fro m those invo lved in aid distribution or a˜ected by the attacks.
Incident,"731 G˜ METHODOLOGY 35 Our res earch involves a t wo -p art analysis: (a) Collection and veri˚cation of visual evidence and reports, and analysis of incidents where aid  was  targeted."
Incident,"36 For (a) , we began collecting information about attacks on civilians s eeking aid and collating them in the GC D (see Chapter 1: Introduction), spe c ifying the availabilit y of vi sual evidence, me dia sources, approximate location (neighbourhood or region), and approximate time. We subsequently investigated each incident to identify its precis e geographic coordinates and time where possible. As a result, most incidents have a con˚rmed approximate location, while s ome are geolocated precis ely."
Incident,"37 Within our corpus of attacks, we include circumstances where the known presence of Israeli military personnel and infrastructure creates choke points for aid logistics where attacks on aid repeatedly and frequentl y occur. At thes e location s which are prone to repeate d attacks, attacks from other arme d Palestinian groups are possible, namely as di˜erent armed groups attempt to wrest control over aid systems. When the speci˚c assailant of an attack is disputed, but when it still occurs at a location of repeated attacks by the Israeli military, we include it in our datas et."
Incident,"38 We us e mapping and ge olocation te chniques (se e Methodology in Chapter 1: Introduction) to accuratel y locate incidents captured in visual evidence. This data is cons idered highly reliable as it allows for pre c ise identi˚cation and mapping of a˜e cte d areas, which i s critical for analysing pattern s in the attacks. We verify incidents using the incident veri˚cation criteria outlined in Chapter 1: Introduction."
Incident,"In this report, we do not identify the speci˚c t ypes of munitions us ed for each attack in question."
Incident,41 We comp ared the data from areas (a) and (b) to  identify  relationships  bet we en  attacks  on aid  and  the understood level of reliance on the various t ypes of aid sites and systems.
Incident,"42 W ith th e att acks collated into one database , we analysed spatial an d temporal patterns alon gside media and vis ual evidence, to identify any relationships bet ween events. This led us to conceptualis e attacks on aid according to discrete temporal phas es of attack where di˜erent types of aid sites and systems were targeted in turn or where suc h attac ks predominantly escalated (see the following subs ection). This identi˚cation of discrete temporal phas es, however, does not mean that the attacks in question only occur within a speci ˚c temporal phase; they occur elsewhere, b ut we have highlighted temporal periods where attacks of a certain nature are signi˚cant Œ namely because of other contextual information and factors that identify thes e periods as signi˚cant beyond the data its elf. A ls o, there are 732 s ome t ypes of attack on aid that do not ˚t neatly into temporal phas es becaus e they have occurred consistently since 7 October 2023. For example, attacks on UNRWA have occurred consistently (s ee Section H10: Attacks on UNWRA and decon˘icted sites)."
Incident,H˜ CHRONOLOGICAL ANALYSIS OF THE TARGETING OF AID 43 The following s ection details the phas es we have obs erved of the Israeli military™s targeting of aid.
Incident,"44 The phas es we have obs erved are the following: (a) OctoberŒNovember 2023: Attacks on Bakeries (b) October 2023˝January 2024: Attacks on Shelters (c) December 2023˝February 2024: Attacks on aid pers onnel Œ police escorting aid convoys (d ) JanuaryŒMarch 2024: Attacks on civilians s eeking aid (e) March 2024: Attacks on aid pers onnel Œ aid administrators (f) October 2023˝September 2024: Attacks on markets (g) October 2023˝September 2024: Attacks on aid infrastructure (h) May 2024: Israeli vigilante attacks on aid destined for Gaza (i) October 2023˝September 2024: Attacks on UNRWA and decon˘icted sites 45 While we have obs erved distinct phas es of Israel™s attacks on aid, attacks on each of thes e categories is not exclusively con˚ned to the phas e identi˚ed. Rather, each of the phas es represents a p articular period during which an acute escalation of attacks on a speci˚c t ype of aid is documented."
Incident,"46 Our identi˚cation of the desc ribed phases appears through a chronological analysis, through which we set out the character and s cale of incidents within each pha se. This chronological analysis enables us to obs erve broader p atterns related to the targeting of aid Œ namely, their correlation with civilian pres ence and their relationship with displacement."
Incident,"733 1˜ OctoberŒNovember 2023: At tacks on bakeries 47 Bakeries in the north of Gaza were attacked when they played a critical role in aid di stribution, f rom the beginning of hostilities until November, at whic h point none were operational in the north of Gaza ."
Incident,"A map of a ttacks o n bake ries: be twee n 7 October a nd 30 December 2023 all the d o cume n ted a ttacks we re in nort hern Ga za; t he two s out hernmost attacks in Deir al-Balah occurred later in December 20 23. The number at t he cent re of t he circle indicates t he number of attacks in t he approximate area (e.g., neighbourhood)."
Incident,"16 4 9 We documented attacks on 14 bakeries in Gaza bet ween October and early November. We als o doc umented two attacks on bakeries in December, in De ir al-Balah, as I srael™s ground operation moved southwards . On 14 November, the last functioning ˜our mill in Gaza was attacked and rendered inoperable."
Incident,"On other occasions, their solar pane ls or generators were hit. Four bakeries were targeted after images of Palestinians queuing outside them were posted online. A video taken on 17 October 2023 shows a queue at the Nus eirat bakery the evening before the bakery was attacked. [31018˚ 625 73] 18 A video of the al-Sofara bake ry was pos ted by Al Jazeera on the m orning of 21 Oc tober 2023, whil e v isual evidence shows the bakery was des troyed the following night. [3102 1˚41258] 19 Images of a queue o uts ide the al-Maghazi al-Jadeed bakery were posted on the mornin g of 24 October 2023 and the bakery was destroyed shortly after. [31024˚20340] A video of the al- Sharq bakery circulated on s ocial media on 2 9 October 2023, and the bakery was attacked on 4 November. [31104˚38923] 20 51 The al-Maghazi al-Jadeed bakery had reportedly received ˜our from UNRWA a few hours before being bombed."
Incident,"22 52 We do cumented: eight c ases, inc lu ding al-Sharq bakery, in w hich the nearby area was bombed, damaging the building and injuring civilians; seven cases, including al-Nuseirat bakery, in which the target was the building in which the bakery was located Œ  with a total of 55 people reportedly killed, including civilians and workers; and one cas e, that of Families Bakery C omp any, where the target was the  s olar  p anels  the  bakery  relied  on  for  electricit y.  [31104˚49709] 53 During October and November 2023, bakeries were bombed north of Wadi Gaza and in central Gaza."
